{
    "$schema": "../skill_library.schema.json",
    "name": "cable_routing_lib",
    "description": "Library with task specifications for cable routing",
    "license": "GNU GPLv3",
    "version": "0.1.0",
    "required_task_libs": [
        {
            "lib_name": "mav_control_lib",
            "repo_url": "git@gitlab.kuleuven.be:todo.git",
            "version": "0.0.0"
        }
    ],
    "authors": [
        {
            "name": "Federico Ulloa Rios",
            "affiliation": "KU Leuven",
            "email": "federico.ulloarios@kuleuven.be"
        }
    ],
    "maintainers": [
        {
            "name": "Federico Ulloa Rios",
            "affiliation": "KU Leuven",
            "email": "federico.ulloarios@kuleuven.be"
        }
    ],
    "acknowledgements": "The authors acknowledge the financial support of EU project AI-Prism (TODO)"
}